<?xml version="1.0" encoding="UTF-8"?>
<xs:schema xmlns:xs="http://www.w3.org/2001/XMLSchema" elementFormDefault="qualified">
  <xs:element name="datos">
    <xs:complexType>
      <xs:sequence>
        <xs:element name="caracteres" type="xs:string"/>
        <xs:element name="decimal" type="xs:decimal"/>
        <xs:element name="entero" type="xs:integer"/>
        <xs:element name="logico" type="xs:boolean"/>
        <xs:element name="fecha" type="xs:date"/>
        <xs:element name="hora" type="xs:time"/>
        <xs:element name="fechaHora" type="xs:dateTime"/>
      </xs:sequence>
    </xs:complexType>
  </xs:element>
</xs:schema>
